{
  "receiptId": "exampleco-medium-receipt-2026-03-24",
  "issuedAt": "2026-03-24T01:30:00Z",
  "bundleId": "exampleco-medium-bundle-2026-03-24",
  "verifierVersion": "opencompliance-verifier/0.9.3",
  "replayBundleId": "exampleco-medium-bundle-2026-03-24-replay",
  "replayResult": "exact_match",
  "witness": {
    "witnessId": "oc-synthetic-independent-witness",
    "witnessType": "independent_witness",
    "witnessRole": "independent_replay_witness",
    "trustPolicyId": "oc.trust.independent-witness"
  },
  "checkedArtifacts": [
    {
      "artifactType": "profile",
      "path": "profile.json",
      "sha256": "ff4d79cbff91378e6020e81bcdd0ccbc8942c3fd92f3ff7dab5e40ef4737302d"
    },
    {
      "artifactType": "evidence_claims",
      "path": "evidence-claims.json",
      "sha256": "a2dca20e7b361f514610188973d6c968d1805e1d933bb9912c762fcc303a0eb7"
    },
    {
      "artifactType": "oscal_catalog",
      "path": "oscal/opencompliance-medium-catalog.json",
      "sha256": "b708e1223124a14e98c7a0e59302e403769d1d82f21544b8512fbc3ec5382f13"
    },
    {
      "artifactType": "oscal_profile",
      "path": "oscal/exampleco-medium-profile.json",
      "sha256": "608f89ad0490727bca70ea9c6039f22c39e040359c7fb40eedb027229087f2f7"
    },
    {
      "artifactType": "proof_bundle",
      "path": "proof-bundle.json",
      "sha256": "661a51462fe63112ca3abc7e9ac7214eadfcf10872097fc690e37e196aa2c351"
    },
    {
      "artifactType": "trust_surface_report",
      "path": "trust-surface-report.md",
      "sha256": "9e801be940e33dd8590a6015834bbc36c1895e246a393a5d8e69cfaf13aa269f"
    },
    {
      "artifactType": "verification_result",
      "path": "verification-result.json",
      "sha256": "277d2b2152c0e0254dbc148610edb1bdf1a570b2b606af2ae00062d743137481"
    },
    {
      "artifactType": "punch_list",
      "path": "punch-list.json",
      "sha256": "3ac889b4d076d4fecaee29207bde4e5e90fe081ff5bba51696485cab7913e1ec"
    }
  ],
  "note": "Synthetic public witness receipt for the richer ExampleCo corridor."
}
