{
  "receiptId": "exampleco-cyber-baseline-receipt-2026-03-24",
  "issuedAt": "2026-03-24T06:15:00Z",
  "bundleId": "exampleco-cyber-baseline-bundle-2026-03-24",
  "verifierVersion": "opencompliance-verifier/0.9.2",
  "replayBundleId": "exampleco-cyber-baseline-bundle-2026-03-24-replay",
  "replayResult": "exact_match",
  "witness": {
    "witnessId": "oc-synthetic-independent-witness",
    "witnessType": "independent_witness",
    "witnessRole": "independent_replay_witness",
    "trustPolicyId": "oc.trust.independent-witness"
  },
  "checkedArtifacts": [
    {
      "artifactType": "profile",
      "path": "profile.json",
      "sha256": "d9049584f9bed1bb9ad6da2ef9e9bd755b9e03b3815b203120b1ad2091935e7f"
    },
    {
      "artifactType": "evidence_claims",
      "path": "evidence-claims.json",
      "sha256": "bb1ab96ae234c1dcc910a94524a18549d364ee4e29897efe5b500c3df42f330f"
    },
    {
      "artifactType": "oscal_catalog",
      "path": "oscal/opencompliance-cyber-baseline-catalog.json",
      "sha256": "5a0257d6af86867fafd352d311b83655508b86ac68ef7137d7e588b27e9833d9"
    },
    {
      "artifactType": "oscal_profile",
      "path": "oscal/exampleco-cyber-baseline-profile.json",
      "sha256": "c2a6a573775f058895d385a417fa43b2f6fcd505a95c7ba96601d27c782ae337"
    },
    {
      "artifactType": "proof_bundle",
      "path": "proof-bundle.json",
      "sha256": "4c3dab496a5bd84d606ad5e3b3a3bd6d16d0c006c0fefee88a14b5e9274e9c33"
    },
    {
      "artifactType": "trust_surface_report",
      "path": "trust-surface-report.md",
      "sha256": "9c4a155895010fd089e14d32dd6757f50e3cef5e66392dbc9d5b89d5865eda14"
    },
    {
      "artifactType": "verification_result",
      "path": "verification-result.json",
      "sha256": "5553fa9b9b3628f34b73eff430a04fa829d7add45b0786129a19d4a02c891967"
    },
    {
      "artifactType": "certificate",
      "path": "certificate.json",
      "sha256": "b44c22297f251f1d796f5b2f9784d17c101f696e0a8506cbec4d2968e6be6d3f"
    }
  ],
  "note": "Synthetic public witness receipt for an exact-match replay of the cyber baseline ExampleCo corridor."
}
