{
  "receiptId": "exampleco-ai-governance-receipt-2026-03-24",
  "issuedAt": "2026-03-24T06:45:00Z",
  "bundleId": "exampleco-ai-governance-bundle-2026-03-24",
  "verifierVersion": "opencompliance-verifier/0.9.8",
  "replayBundleId": "exampleco-ai-governance-bundle-2026-03-24-replay",
  "replayResult": "exact_match",
  "witness": {
    "witnessId": "oc-synthetic-independent-witness",
    "witnessType": "independent_witness",
    "witnessRole": "independent_replay_witness",
    "trustPolicyId": "oc.trust.independent-witness"
  },
  "checkedArtifacts": [
    {
      "artifactType": "profile",
      "path": "profile.json",
      "sha256": "f2a73eafb4e25ef9610edd5255f0bddbeddf2e0e52b2c5f40cdec4ba7fae7e82"
    },
    {
      "artifactType": "evidence_claims",
      "path": "evidence-claims.json",
      "sha256": "28b1e092ad38505ed6b9f5a3a67672e10412be36bf15adcb95576279403ab59c"
    },
    {
      "artifactType": "oscal_catalog",
      "path": "oscal/opencompliance-ai-governance-catalog.json",
      "sha256": "8655b1020c6dff95a1ea4bdb7178d17308b45854e34d5cc61e736c924d15eabd"
    },
    {
      "artifactType": "oscal_profile",
      "path": "oscal/exampleco-ai-governance-profile.json",
      "sha256": "d1deea69f0cd41add764dde2bed40cb659528abe34f6d7b4a03ab90b1d394b70"
    },
    {
      "artifactType": "proof_bundle",
      "path": "proof-bundle.json",
      "sha256": "0b7ee1c3271af4a9337d935adee2fabd65a85e18d2d9755a9c2fbf31864ebdc4"
    },
    {
      "artifactType": "trust_surface_report",
      "path": "trust-surface-report.md",
      "sha256": "cb99bce3dd10c73036fb1976774ef511cea83b9618d76ac10e8c325bbf32badd"
    },
    {
      "artifactType": "verification_result",
      "path": "verification-result.json",
      "sha256": "47a6ee2474f24a8320354aacb73f21a6c1cebfb5a019df8ef2058d4ca1a4d4d8"
    },
    {
      "artifactType": "punch_list",
      "path": "punch-list.json",
      "sha256": "61e3ff2a963738bc2b95ddf9741a0ab8febfff35fcce33a3c377f03b0ae2f5b6"
    }
  ],
  "note": "Synthetic public witness receipt for an exact-match replay of the AI governance ExampleCo corridor."
}
