{
  "receiptId": "exampleco-minimal-receipt-2026-03-24",
  "issuedAt": "2026-03-24T00:10:00Z",
  "bundleId": "exampleco-minimal-bundle-2026-03-24",
  "verifierVersion": "opencompliance-verifier/0.9.8",
  "replayBundleId": "exampleco-minimal-bundle-2026-03-24-replay",
  "replayResult": "exact_match",
  "witness": {
    "witnessId": "oc-synthetic-independent-witness",
    "witnessType": "independent_witness",
    "witnessRole": "independent_replay_witness",
    "trustPolicyId": "oc.trust.independent-witness"
  },
  "checkedArtifacts": [
    {
      "artifactType": "profile",
      "path": "profile.json",
      "sha256": "63a3124d1b3d1f82f76ccd995c325377c2dacae3754c746e560e302d77f8e89d"
    },
    {
      "artifactType": "evidence_claims",
      "path": "evidence-claims.json",
      "sha256": "48e4a9b9dd3896e91b6b8b6a03a7f365d5a55d96881020926b5474e053f61e1d"
    },
    {
      "artifactType": "oscal_catalog",
      "path": "oscal/opencompliance-minimal-catalog.json",
      "sha256": "efef7b1cbbb4fd3765bbed526c14eb0f5b6d82bfa3eae60b971b4d65381eadfa"
    },
    {
      "artifactType": "oscal_profile",
      "path": "oscal/exampleco-minimal-profile.json",
      "sha256": "3d5e8137924bf3bf5689c47cf26db5824b357f76f92af16618af0ba98f0910f5"
    },
    {
      "artifactType": "proof_bundle",
      "path": "proof-bundle.json",
      "sha256": "af18cb6ed168373c3d381562e6eec506d26f112b26674158d6dcdf903d121dfa"
    },
    {
      "artifactType": "trust_surface_report",
      "path": "trust-surface-report.md",
      "sha256": "485c6c6a5b4ee0693f663cc4c688c9bbd6d3848abb1710c2c3046b55ab72332c"
    },
    {
      "artifactType": "verification_result",
      "path": "verification-result.json",
      "sha256": "ea8b7cca1042390528f938c015371d45dcd28d5b58ed4c96fb2327a50a542762"
    },
    {
      "artifactType": "punch_list",
      "path": "punch-list.json",
      "sha256": "f1b8af07821cea8917d4d3acbde414375d6df5bb284732359755bd3d7113a48d"
    }
  ],
  "note": "Synthetic public witness receipt for exact-match replay."
}
