{
  "receiptId": "exampleco-ai-governance-receipt-2026-03-24",
  "issuedAt": "2026-03-24T06:45:00Z",
  "bundleId": "exampleco-ai-governance-bundle-2026-03-24",
  "verifierVersion": "opencompliance-verifier/0.9.2",
  "replayBundleId": "exampleco-ai-governance-bundle-2026-03-24-replay",
  "replayResult": "exact_match",
  "witness": {
    "witnessId": "oc-synthetic-independent-witness",
    "witnessType": "independent_witness",
    "witnessRole": "independent_replay_witness",
    "trustPolicyId": "oc.trust.independent-witness"
  },
  "checkedArtifacts": [
    {
      "artifactType": "profile",
      "path": "profile.json",
      "sha256": "f2a73eafb4e25ef9610edd5255f0bddbeddf2e0e52b2c5f40cdec4ba7fae7e82"
    },
    {
      "artifactType": "evidence_claims",
      "path": "evidence-claims.json",
      "sha256": "97d775b3ed13c0a491441defcb04c0bfc9f0d177491ea5359d6ade0a0dc00006"
    },
    {
      "artifactType": "oscal_catalog",
      "path": "oscal/opencompliance-ai-governance-catalog.json",
      "sha256": "4e48cd4bcb9f5c25358eafc34445ea9f7bc88333cbfc2e821849d55530e29958"
    },
    {
      "artifactType": "oscal_profile",
      "path": "oscal/exampleco-ai-governance-profile.json",
      "sha256": "ef25798b8c3e44dbd37c0d17dcaab917392c149bb74c9eaaf758d4fada46d002"
    },
    {
      "artifactType": "proof_bundle",
      "path": "proof-bundle.json",
      "sha256": "91d404050cd95867b887a4207b7d40d4799d988866dd705cf45e4c2986d7f6b2"
    },
    {
      "artifactType": "trust_surface_report",
      "path": "trust-surface-report.md",
      "sha256": "922151c7eac4979bfe082eb9b4a0b10fa365d99000f2058c3ff0849608317d82"
    },
    {
      "artifactType": "verification_result",
      "path": "verification-result.json",
      "sha256": "32dc6b2ad6c42de974c7c10664f782619f4e91dc0e5404ab8744340330b3ba54"
    },
    {
      "artifactType": "certificate",
      "path": "certificate.json",
      "sha256": "741db784892440e2b083757ef09eba3ab17e545fc1b266cc5e971c49612e9ae4"
    }
  ],
  "note": "Synthetic public witness receipt for an exact-match replay of the AI governance ExampleCo corridor."
}
