{
  "receiptId": "exampleco-issued-receipt-2026-03-24",
  "issuedAt": "2026-03-24T02:15:00Z",
  "bundleId": "exampleco-issued-bundle-2026-03-24",
  "verifierVersion": "opencompliance-verifier/0.9.5",
  "replayBundleId": "exampleco-issued-bundle-2026-03-24-replay",
  "replayResult": "exact_match",
  "witness": {
    "witnessId": "oc-synthetic-independent-witness",
    "witnessType": "independent_witness",
    "witnessRole": "independent_replay_witness",
    "trustPolicyId": "oc.trust.independent-witness"
  },
  "checkedArtifacts": [
    {
      "artifactType": "profile",
      "path": "profile.json",
      "sha256": "e5baaad412dd7a1c83956c97b1c0da0e24fefd1569b776ebf098eefbde55ad2f"
    },
    {
      "artifactType": "evidence_claims",
      "path": "evidence-claims.json",
      "sha256": "311f474bf80236d03d0cf9df4f67a1dedc63d8baf7ced15c431f579caeda7606"
    },
    {
      "artifactType": "oscal_catalog",
      "path": "oscal/opencompliance-issued-catalog.json",
      "sha256": "f6ffdb81567b41a545687cb5bbe884c715cad8d81270f0a54ecda98aeb5713ef"
    },
    {
      "artifactType": "oscal_profile",
      "path": "oscal/exampleco-issued-profile.json",
      "sha256": "1f0fbd754f857ae88d5a16c38f0c20a2d97515810f70ee698dd39c6a6ae60887"
    },
    {
      "artifactType": "proof_bundle",
      "path": "proof-bundle.json",
      "sha256": "8c3c32857dd4553334cfefd0b41677be31e78bcdd18806e243d93f87c8eec602"
    },
    {
      "artifactType": "trust_surface_report",
      "path": "trust-surface-report.md",
      "sha256": "d23ec5a6abb39727d6f763cb1498fc764a9b81a3e1793a29f876574b2b6ff226"
    },
    {
      "artifactType": "verification_result",
      "path": "verification-result.json",
      "sha256": "89d13093a939afbd763814c30c54cda56f38028ed45fe1a4cca5fc5b213cfb24"
    },
    {
      "artifactType": "certificate",
      "path": "certificate.json",
      "sha256": "56432ced31cc58a35737232d33c50f1e4ca71c13f46abdfb94c268a320900d41"
    }
  ],
  "note": "Synthetic public witness receipt for an exact-match replay of the issued ExampleCo corridor."
}
