{
  "receiptId": "exampleco-cyber-baseline-receipt-2026-03-24",
  "issuedAt": "2026-03-24T06:15:00Z",
  "bundleId": "exampleco-cyber-baseline-bundle-2026-03-24",
  "verifierVersion": "opencompliance-verifier/0.9.7",
  "replayBundleId": "exampleco-cyber-baseline-bundle-2026-03-24-replay",
  "replayResult": "exact_match",
  "witness": {
    "witnessId": "oc-synthetic-independent-witness",
    "witnessType": "independent_witness",
    "witnessRole": "independent_replay_witness",
    "trustPolicyId": "oc.trust.independent-witness"
  },
  "checkedArtifacts": [
    {
      "artifactType": "profile",
      "path": "profile.json",
      "sha256": "d9049584f9bed1bb9ad6da2ef9e9bd755b9e03b3815b203120b1ad2091935e7f"
    },
    {
      "artifactType": "evidence_claims",
      "path": "evidence-claims.json",
      "sha256": "b54de7342bafd5788ba5305741ddeddb8aaf3f78a2ed0354e94e2a6672c668a0"
    },
    {
      "artifactType": "oscal_catalog",
      "path": "oscal/opencompliance-cyber-baseline-catalog.json",
      "sha256": "a9f8ee95a58cf682a049dfa96fb60874628918e35a6c381e158a144aebc97206"
    },
    {
      "artifactType": "oscal_profile",
      "path": "oscal/exampleco-cyber-baseline-profile.json",
      "sha256": "2a74067ff8825133ece91e4f5d944d265611c2ef5bf4299f4671135022280f1f"
    },
    {
      "artifactType": "proof_bundle",
      "path": "proof-bundle.json",
      "sha256": "644b7e4155b2047b452f090f0def681c02f8ef1abf1628f0095a1a44baa20b87"
    },
    {
      "artifactType": "trust_surface_report",
      "path": "trust-surface-report.md",
      "sha256": "9c4a155895010fd089e14d32dd6757f50e3cef5e66392dbc9d5b89d5865eda14"
    },
    {
      "artifactType": "verification_result",
      "path": "verification-result.json",
      "sha256": "3563f97e848e51a0fa31042ce73bc17b8a6c1f442777901d51c70e8eaa074505"
    },
    {
      "artifactType": "certificate",
      "path": "certificate.json",
      "sha256": "b5a5d7971a6571f51b0d7fae586b4355f413922ea6d8786ece532586304cbef7"
    }
  ],
  "note": "Synthetic public witness receipt for an exact-match replay of the cyber baseline ExampleCo corridor."
}
